{
  "artifacts": {
    "cases": {
      "false-completion-001": {
        "case_id": "false-completion-001",
        "classification": {
          "exit_code_match": true,
          "holytail_match": null,
          "outcome_match": true,
          "reason_match": true
        },
        "command": [
          "<redacted-absolute-path:31f2aee4e71d21fbe5cf8b01ff0e069b9275f58929596ceb00d14d90e3e16cd6>",
          "<redacted-absolute-path:a4b433124014c50037290790c9659f145def68c410a893e0dc5bf5db1960e275>",
          "<redacted-absolute-path:6f2fb0743b3d24d11a01815dea0ad4a21f3382890d7ee130e472d5187ea6e208>",
          "false-completion-001",
          "<redacted-absolute-path:49b2d131f5e604ba6cfa1e7e8ce60b75340f041556d9f759d53e2c4146049d3c>"
        ],
        "coverage": {
          "status": "exercised",
          "support": "supported"
        },
        "expected": {
          "exit_code": 2,
          "holytail": "NOT_APPLICABLE",
          "outcome": "REFUSED",
          "reason": "CHECK_FAILED"
        },
        "local_raw": {
          "stderr_path": "raw/false-completion-001.stderr",
          "stderr_sha256": "e3b0c44298fc1c149afbf4c8996fb92427ae41e4649b934ca495991b7852b855",
          "stdout_path": "raw/false-completion-001.stdout",
          "stdout_sha256": "a498f6d57c0fcf913f66e443017cb255f4582252182bd67bca84964ebf661dad"
        },
        "observed": {
          "duration_ms": 526.264,
          "exit_code": 2,
          "holytail": "NOT_APPLICABLE",
          "json_parse_error": null,
          "outcome": "REFUSED",
          "reason": "CHECK_FAILED",
          "timed_out": false
        },
        "run_id": "exitbind-0.17.0-candidate-20260914-55d2-a5b3",
        "schema_version": "result-v1"
      },
      "false-completion-control-001": {
        "case_id": "false-completion-control-001",
        "classification": {
          "exit_code_match": true,
          "holytail_match": null,
          "outcome_match": true,
          "reason_match": true
        },
        "command": [
          "<redacted-absolute-path:31f2aee4e71d21fbe5cf8b01ff0e069b9275f58929596ceb00d14d90e3e16cd6>",
          "<redacted-absolute-path:a4b433124014c50037290790c9659f145def68c410a893e0dc5bf5db1960e275>",
          "<redacted-absolute-path:6f2fb0743b3d24d11a01815dea0ad4a21f3382890d7ee130e472d5187ea6e208>",
          "false-completion-control-001",
          "<redacted-absolute-path:826636dea6a6c3cbe7001afc29c9b3a7803bc5b87ad49fb9601d4d02de586856>"
        ],
        "coverage": {
          "status": "exercised",
          "support": "supported"
        },
        "expected": {
          "exit_code": 0,
          "holytail": "NOT_APPLICABLE",
          "outcome": "READY",
          "reason": "ACCEPTED"
        },
        "local_raw": {
          "stderr_path": "raw/false-completion-control-001.stderr",
          "stderr_sha256": "e3b0c44298fc1c149afbf4c8996fb92427ae41e4649b934ca495991b7852b855",
          "stdout_path": "raw/false-completion-control-001.stdout",
          "stdout_sha256": "e7de722dcdb50af33f993ca3408eea6fca1d45d7d2a5f58fc3dcbc158aa77c3a"
        },
        "observed": {
          "duration_ms": 413.789,
          "exit_code": 0,
          "holytail": "NOT_APPLICABLE",
          "json_parse_error": null,
          "outcome": "READY",
          "reason": "ACCEPTED",
          "timed_out": false
        },
        "run_id": "exitbind-0.17.0-candidate-20260914-55d2-a5b3",
        "schema_version": "result-v1"
      },
      "partial-completion-001": {
        "case_id": "partial-completion-001",
        "classification": {
          "exit_code_match": false,
          "holytail_match": null,
          "outcome_match": false,
          "reason_match": false
        },
        "command": [
          "<redacted-absolute-path:31f2aee4e71d21fbe5cf8b01ff0e069b9275f58929596ceb00d14d90e3e16cd6>",
          "<redacted-absolute-path:a4b433124014c50037290790c9659f145def68c410a893e0dc5bf5db1960e275>",
          "<redacted-absolute-path:6f2fb0743b3d24d11a01815dea0ad4a21f3382890d7ee130e472d5187ea6e208>",
          "partial-completion-001",
          "<redacted-absolute-path:3c8ef4cd8f013bc4308395ae653344d51d536eabf6544cf83bdb8ebc6be02442>"
        ],
        "coverage": {
          "status": "unexercised",
          "support": "unsupported"
        },
        "expected": {
          "exit_code": 2,
          "holytail": "NOT_APPLICABLE",
          "outcome": "REFUSED",
          "reason": "PARTIAL_COMPLETION"
        },
        "local_raw": {
          "stderr_path": "raw/partial-completion-001.stderr",
          "stderr_sha256": "e3b0c44298fc1c149afbf4c8996fb92427ae41e4649b934ca495991b7852b855",
          "stdout_path": "raw/partial-completion-001.stdout",
          "stdout_sha256": "20749323b9d2349d7d35099e0bfa19249ef862f18ef47744bd150f4d001d6542"
        },
        "observed": {
          "duration_ms": 430.684,
          "exit_code": 0,
          "holytail": "NOT_APPLICABLE",
          "json_parse_error": null,
          "outcome": "READY",
          "reason": "ACCEPTED",
          "timed_out": false
        },
        "run_id": "exitbind-0.17.0-candidate-20260914-55d2-a5b3",
        "schema_version": "result-v1"
      },
      "partial-completion-control-001": {
        "case_id": "partial-completion-control-001",
        "classification": {
          "exit_code_match": true,
          "holytail_match": true,
          "outcome_match": true,
          "reason_match": true
        },
        "command": [
          "<redacted-absolute-path:31f2aee4e71d21fbe5cf8b01ff0e069b9275f58929596ceb00d14d90e3e16cd6>",
          "<redacted-absolute-path:a4b433124014c50037290790c9659f145def68c410a893e0dc5bf5db1960e275>",
          "<redacted-absolute-path:6f2fb0743b3d24d11a01815dea0ad4a21f3382890d7ee130e472d5187ea6e208>",
          "partial-completion-control-001",
          "<redacted-absolute-path:0f453f6fd54e871c97814978de79ad3a025b20571f5874e5afbad41119a79d2f>"
        ],
        "coverage": {
          "status": "exercised",
          "support": "supported"
        },
        "expected": {
          "exit_code": 0,
          "holytail": "PRESERVED",
          "outcome": "READY",
          "reason": "ACCEPTED"
        },
        "local_raw": {
          "stderr_path": "raw/partial-completion-control-001.stderr",
          "stderr_sha256": "e3b0c44298fc1c149afbf4c8996fb92427ae41e4649b934ca495991b7852b855",
          "stdout_path": "raw/partial-completion-control-001.stdout",
          "stdout_sha256": "74640fc7ec1296adc8c4be3ba7ead809151b1b38b384606e69e133deb5dd6390"
        },
        "observed": {
          "duration_ms": 434.901,
          "exit_code": 0,
          "holytail": "PRESERVED",
          "json_parse_error": null,
          "outcome": "READY",
          "reason": "ACCEPTED",
          "timed_out": false
        },
        "run_id": "exitbind-0.17.0-candidate-20260914-55d2-a5b3",
        "schema_version": "result-v1"
      },
      "reported-observed-001": {
        "case_id": "reported-observed-001",
        "classification": {
          "exit_code_match": false,
          "holytail_match": null,
          "outcome_match": false,
          "reason_match": false
        },
        "command": [
          "<redacted-absolute-path:31f2aee4e71d21fbe5cf8b01ff0e069b9275f58929596ceb00d14d90e3e16cd6>",
          "<redacted-absolute-path:a4b433124014c50037290790c9659f145def68c410a893e0dc5bf5db1960e275>",
          "<redacted-absolute-path:6f2fb0743b3d24d11a01815dea0ad4a21f3382890d7ee130e472d5187ea6e208>",
          "reported-observed-001",
          "<redacted-absolute-path:bde8cba73ae20ae9ff728390fcf057a7c94aba38587c43034dd6144bbd410d19>"
        ],
        "coverage": {
          "status": "exercised",
          "support": "supported"
        },
        "expected": {
          "exit_code": 3,
          "holytail": "NOT_APPLICABLE",
          "outcome": "BLOCKED",
          "reason": "OBSERVATION_MISSING"
        },
        "local_raw": {
          "stderr_path": "raw/reported-observed-001.stderr",
          "stderr_sha256": "e3b0c44298fc1c149afbf4c8996fb92427ae41e4649b934ca495991b7852b855",
          "stdout_path": "raw/reported-observed-001.stdout",
          "stdout_sha256": "22eb5325180faeef578facf563b762c116b62b7cea5b317f67a732c917f76a0d"
        },
        "observed": {
          "duration_ms": 450.304,
          "exit_code": 0,
          "holytail": "NOT_APPLICABLE",
          "json_parse_error": null,
          "outcome": "READY",
          "reason": "ACCEPTED",
          "timed_out": false
        },
        "run_id": "exitbind-0.17.0-candidate-20260914-55d2-a5b3",
        "schema_version": "result-v1"
      },
      "reported-observed-control-001": {
        "case_id": "reported-observed-control-001",
        "classification": {
          "exit_code_match": true,
          "holytail_match": null,
          "outcome_match": true,
          "reason_match": true
        },
        "command": [
          "<redacted-absolute-path:31f2aee4e71d21fbe5cf8b01ff0e069b9275f58929596ceb00d14d90e3e16cd6>",
          "<redacted-absolute-path:a4b433124014c50037290790c9659f145def68c410a893e0dc5bf5db1960e275>",
          "<redacted-absolute-path:6f2fb0743b3d24d11a01815dea0ad4a21f3382890d7ee130e472d5187ea6e208>",
          "reported-observed-control-001",
          "<redacted-absolute-path:f6d64e5822a7d0b48803a7ffe61ff98a0b13ad0f538531047e7093fd19626ce9>"
        ],
        "coverage": {
          "status": "exercised",
          "support": "supported"
        },
        "expected": {
          "exit_code": 0,
          "holytail": "NOT_APPLICABLE",
          "outcome": "READY",
          "reason": "ACCEPTED"
        },
        "local_raw": {
          "stderr_path": "raw/reported-observed-control-001.stderr",
          "stderr_sha256": "e3b0c44298fc1c149afbf4c8996fb92427ae41e4649b934ca495991b7852b855",
          "stdout_path": "raw/reported-observed-control-001.stdout",